{
  "artifact_id": "browseforge-runtime-chromium-v0.1.0-alpha.0-linux-x64",
  "detector": {
    "category": "authenticity_score",
    "detector_id": "browserscan",
    "manifest_ref": "knowledge/manifests/detectors.json#browserscan",
    "name": "BrowserScan",
    "url": "https://www.browserscan.net/"
  },
  "evidence_id": "evidence_linux_x64_browserscan_uach_headless_docker_direct_20260709",
  "failure_mode": "none",
  "harness": {
    "mode": "live_collect",
    "name": "browseforge-detector-harness",
    "version": "0.1.0"
  },
  "kg": {
    "edges": [],
    "nodes": []
  },
  "matrix": {
    "container": true,
    "display_mode": "headless",
    "matrix_key": "linux-x64:browserscan:uach:headless:direct:container",
    "network_mode": "direct",
    "proxy": "none",
    "required": false
  },
  "results": [
    {
      "detector_check": "browserscan_fingerprint_check_js_api",
      "evidence_ref": "sanitized_runtime_observation",
      "finding": "BrowserScan page loaded in the rebuilt packaged Linux runtime and navigator.userAgentData high entropy values matched the configured Linux Chromium persona, including fullVersionList Chromium 150.0.7871.101.",
      "normalized_values": {
        "available": true,
        "fullVersionList_present": true,
        "highEntropy": {
          "architecture": "x86",
          "bitness": "64",
          "brands": [
            {
              "brand": "Not;A=Brand",
              "version": "8"
            },
            {
              "brand": "Chromium",
              "version": "150"
            }
          ],
          "fullVersionList": [
            {
              "brand": "Not;A=Brand",
              "version": "8"
            },
            {
              "brand": "Chromium",
              "version": "150.0.7871.101"
            }
          ],
          "mobile": false,
          "model": "",
          "platform": "Linux",
          "platformVersion": "6.8.0",
          "wow64": false
        },
        "lowEntropy": {
          "brands": [
            {
              "brand": "Not;A=Brand",
              "version": "8"
            },
            {
              "brand": "Chromium",
              "version": "150"
            }
          ],
          "mobile": false,
          "platform": "Linux"
        },
        "title": "Best BrowserScan Fingerprint Detection Tool - Improve your online privacy security | BrowserScan",
        "url": "https://www.browserscan.net/"
      },
      "raw_value_hash": "82b0792e893d11f9acc0a415552da8c14745f3d80802acfcd1d064b1a5f7459b",
      "severity": "low",
      "status": "pass",
      "surface": "client_hints"
    }
  ],
  "run_id": "detrun_linux_x64_browserscan_uach_headless_docker_direct_20260709",
  "runtime_id": "browseforge-chromium",
  "runtime_version": "v0.1.0-alpha.0",
  "sanitization": {
    "cookies_storage_redacted": true,
    "credentials_redacted": true,
    "ip_redacted": true,
    "notes": "Raw BrowserScan page text, browser storage, and network identifiers are not committed; committed evidence stores sanitized page title/url, structured UA-CH values, text hash/excerpt hash reference, and raw capture SHA only.",
    "profiles_redacted": true,
    "raw_capture_committed": false,
    "sanitizer_version": "source-detector-harness-browserscan-uach-1",
    "screenshot_metadata_redacted": true,
    "tokens_redacted": true
  },
  "schema_version": "1.1",
  "status": "passed",
  "storage": {
    "evidence_path": "detectors/evidence/v0.1.0-alpha.0/linux-x64/browserscan/detrun_linux_x64_browserscan_uach_headless_docker_direct_20260709.json",
    "raw_capture_sha256": "bcbdffeb7cf5477136bc96c2d3ab07f14f9f645a1d1e355816c76103f2d243d1",
    "sha256": "ce61d9e09007ce8e45149a0f64209151a525bac3045d381c63407c8b44e79317",
    "summary_path": "detector-summary.json"
  },
  "target": {
    "arch": "amd64",
    "browser_family": "chromium",
    "browser_version": "150.0.7871.101",
    "container": true,
    "gpu_mode": "headless swiftshader",
    "host_os": "macOS Docker Desktop linux/amd64 emulation",
    "locale_profile": "zh-TW",
    "platform": "linux-x64",
    "proxy_region_redacted": "none",
    "timezone_profile": "Asia/Taipei"
  },
  "tested_at": "2026-07-09T09:12:20.399409+00:00"
}
