{
  "schema_version": "1.1",
  "run_id": "detrun_v0.1.0-alpha.0_macos-arm64_sannysoft_local-dogfood_rerun1",
  "evidence_id": "evidence_v0.1.0-alpha.0_macos-arm64_sannysoft_local-dogfood_rerun1",
  "runtime_id": "browseforge-chromium",
  "runtime_version": "v0.1.0-alpha.0",
  "artifact_id": "local-external-chrome:macos-arm64:150.0.7871.49",
  "detector": {
    "detector_id": "sannysoft",
    "name": "SannySoft",
    "url": "https://bot.sannysoft.com/",
    "category": "automation",
    "manifest_ref": "knowledge/manifests/detectors.json#sannysoft"
  },
  "tested_at": "2026-07-08T07:09:36.554064Z",
  "harness": {
    "name": "browseforge-detector-harness",
    "version": "0.1.0",
    "mode": "manual_ingest"
  },
  "target": {
    "platform": "macos-arm64",
    "browser_family": "chromium",
    "browser_version": "Google Chrome 150.0.7871.49",
    "host_os": "darwin",
    "arch": "arm64",
    "container": false,
    "gpu_mode": "host",
    "proxy_region_redacted": "none",
    "locale_profile": "zh-TW",
    "timezone_profile": "not_recorded"
  },
  "matrix": {
    "matrix_key": "macos-arm64:sannysoft:headed:direct:host",
    "display_mode": "headed",
    "network_mode": "direct",
    "container": false,
    "proxy": "none",
    "required": true
  },
  "status": "warning",
  "failure_mode": "none",
  "results": [
    {
      "surface": "automation_signals",
      "status": "pass",
      "severity": "info",
      "finding": "SannySoft rerun reported WebDriver missing, WebDriver Advanced passed, Chrome present, plugins PluginArray passed, and Selenium/Phantom checks returned ok.",
      "mitigation": "BrowseForge now owns --disable-blink-features=AutomationControlled, filters --enable-automation, and installs a context init script before detector navigation.",
      "detector_check": "WebDriver/New, WebDriver Advanced, Chrome/New, Plugins, PHANTOM_*, SELENIUM_DRIVER",
      "normalized_values": {
        "navigator.webdriver": null,
        "webdriver_type": "undefined",
        "plugins_length": 5,
        "chrome_runtime_object": false
      },
      "evidence_ref": "sanitized_dom_summary"
    },
    {
      "surface": "webgl",
      "status": "warn",
      "severity": "medium",
      "finding": "SannySoft observed host Apple/ANGLE WebGL renderer; this is coherent with macOS local dogfood but not scored against a generated target persona.",
      "detector_check": "WebGL Vendor, WebGL Renderer",
      "normalized_values": {
        "renderer": "ANGLE (Apple, ANGLE Metal Renderer: Apple M5 Pro, Unspecified Version)",
        "vendor": "Google Inc. (Apple)"
      },
      "evidence_ref": "sanitized_dom_summary"
    },
    {
      "surface": "locale",
      "status": "pass",
      "severity": "info",
      "finding": "SannySoft observed zh-TW language list in local dogfood capture.",
      "detector_check": "Languages/Old, PHANTOM_LANGUAGE",
      "normalized_values": {
        "language": "zh-TW",
        "languages": [
          "zh-TW",
          "zh",
          "en-US",
          "en"
        ]
      },
      "evidence_ref": "sanitized_dom_summary"
    },
    {
      "surface": "canvas",
      "status": "warn",
      "severity": "low",
      "finding": "SannySoft canvas rows returned stable hashes in local dogfood; no cross-persona or cross-session canvas noise target was scored.",
      "detector_check": "Canvas1..Canvas5",
      "evidence_ref": "sanitized_dom_summary"
    },
    {
      "surface": "permissions",
      "status": "pass",
      "severity": "info",
      "finding": "SannySoft permissions checks returned prompt/ok in local dogfood capture.",
      "detector_check": "Permissions/New, HEADCHR_PERMISSIONS",
      "evidence_ref": "sanitized_dom_summary"
    }
  ],
  "sanitization": {
    "ip_redacted": true,
    "credentials_redacted": true,
    "profiles_redacted": true,
    "tokens_redacted": true,
    "cookies_storage_redacted": true,
    "screenshot_metadata_redacted": true,
    "raw_capture_committed": false,
    "sanitizer_version": "0.1.0",
    "notes": "Committed evidence is a sanitized REST/eval summary. Raw DOM, endpoint, token, profile/session identifiers, cookies/storage, screenshots, IPs, and local URLs were omitted or redacted."
  },
  "storage": {
    "evidence_path": "detectors/local-sannysoft-dogfood.sanitized.json",
    "sha256": "ac4340800360cea6ba124a3d31621d12c13dcb5b94405cfe8dce827f04cd5bc6"
  },
  "kg": {
    "nodes": [
      {
        "label": "DetectorRun",
        "id": "detrun_v0.1.0-alpha.0_macos-arm64_sannysoft_local-dogfood_rerun1",
        "properties": {
          "status": "warning",
          "failure_mode": "none",
          "matrix_key": "macos-arm64:sannysoft:headed:direct:host"
        }
      },
      {
        "label": "EvidenceArtifact",
        "id": "evidence_v0.1.0-alpha.0_macos-arm64_sannysoft_local-dogfood_rerun1",
        "properties": {
          "path": "detectors/local-sannysoft-dogfood.sanitized.json",
          "sha256": "ac4340800360cea6ba124a3d31621d12c13dcb5b94405cfe8dce827f04cd5bc6",
          "sanitized": true
        }
      }
    ],
    "edges": [
      {
        "from": "detrun_v0.1.0-alpha.0_macos-arm64_sannysoft_local-dogfood_rerun1",
        "edge": "RUNS_DETECTOR",
        "to": "sannysoft"
      },
      {
        "from": "detrun_v0.1.0-alpha.0_macos-arm64_sannysoft_local-dogfood_rerun1",
        "edge": "TESTS_ARTIFACT",
        "to": "local-external-chrome:macos-arm64:150.0.7871.49"
      },
      {
        "from": "evidence_v0.1.0-alpha.0_macos-arm64_sannysoft_local-dogfood_rerun1",
        "edge": "EVIDENCES",
        "to": "detrun_v0.1.0-alpha.0_macos-arm64_sannysoft_local-dogfood_rerun1"
      },
      {
        "from": "sannysoft",
        "edge": "CHECKS_SURFACE",
        "to": "automation_signals"
      },
      {
        "from": "sannysoft",
        "edge": "CHECKS_SURFACE",
        "to": "canvas"
      },
      {
        "from": "sannysoft",
        "edge": "CHECKS_SURFACE",
        "to": "locale"
      },
      {
        "from": "sannysoft",
        "edge": "CHECKS_SURFACE",
        "to": "permissions"
      },
      {
        "from": "sannysoft",
        "edge": "CHECKS_SURFACE",
        "to": "webgl"
      }
    ]
  }
}
