{
  "artifact_id": "browseforge-runtime-chromium-v0.1.0-alpha.0-linux-x64",
  "detector": {
    "category": "trustworthiness",
    "detector_id": "iphey",
    "manifest_ref": "knowledge/manifests/detectors.json#iphey",
    "name": "iphey",
    "url": "https://iphey.com/"
  },
  "evidence_id": "evidence_linux_x64_iphey_uach_headless_docker_direct_20260709",
  "failure_mode": "none",
  "harness": {
    "mode": "live_collect",
    "name": "browseforge-detector-harness",
    "version": "0.1.0"
  },
  "kg": {
    "edges": [],
    "nodes": []
  },
  "matrix": {
    "container": true,
    "display_mode": "headless",
    "matrix_key": "linux-x64:iphey:uach:headless:direct:container",
    "network_mode": "direct",
    "proxy": "none",
    "required": false
  },
  "results": [
    {
      "detector_check": "iphey_fingerprint_check_js_api",
      "evidence_ref": "sanitized_runtime_observation",
      "finding": "iphey page loaded in the rebuilt packaged Linux runtime and navigator.userAgentData high entropy values matched the configured Linux Chromium persona, including fullVersionList Chromium 150.0.7871.101.",
      "normalized_values": {
        "available": true,
        "fullVersionList_present": true,
        "highEntropy": {
          "architecture": "x86",
          "bitness": "64",
          "brands": [
            {
              "brand": "Not;A=Brand",
              "version": "8"
            },
            {
              "brand": "Chromium",
              "version": "150"
            }
          ],
          "fullVersionList": [
            {
              "brand": "Not;A=Brand",
              "version": "8"
            },
            {
              "brand": "Chromium",
              "version": "150.0.7871.101"
            }
          ],
          "mobile": false,
          "model": "",
          "platform": "Linux",
          "platformVersion": "6.8.0",
          "wow64": false
        },
        "lowEntropy": {
          "brands": [
            {
              "brand": "Not;A=Brand",
              "version": "8"
            },
            {
              "brand": "Chromium",
              "version": "150"
            }
          ],
          "mobile": false,
          "platform": "Linux"
        },
        "title": "Iphey - Real-Time Browser Fingerprinting Test -\u00a0 IPhey",
        "url": "https://iphey.com/"
      },
      "raw_value_hash": "ebbdb9e50df6aa999bf1b081c6432ecaec02959d6041f404002342a67229e634",
      "severity": "low",
      "status": "pass",
      "surface": "client_hints"
    },
    {
      "detector_check": "iphey_runtime_probe_audio",
      "evidence_ref": "sanitized_runtime_observation",
      "finding": "iphey page context produced sanitized OfflineAudioContext summary with deterministic sampleRate/length/sum fields; raw samples are limited to sanitized numeric summary.",
      "normalized_values": {
        "available": true,
        "firstSamples": [
          -6.1e-07,
          4.4e-07,
          -4.4e-07,
          1.4e-07,
          1e-08,
          1.3e-07,
          -3.3e-07,
          8.7e-07
        ],
        "length": 44100,
        "sampleRate": 44100,
        "sum": 7.2e-07,
        "sumAbs": 0.00017846
      },
      "severity": "info",
      "status": "pass",
      "surface": "audio"
    },
    {
      "detector_check": "iphey_runtime_probe_fonts",
      "evidence_ref": "sanitized_runtime_observation",
      "finding": "iphey page context reported document.fonts.check availability for sampled desktop font families; this is availability evidence, not glyph raster parity.",
      "normalized_values": {
        "available": true,
        "checks": {
          "Arial": true,
          "Calibri": false,
          "Consolas": false,
          "Courier New": true,
          "DejaVu Sans": true,
          "Noto Sans CJK TC": true,
          "Segoe UI": false,
          "Times New Roman": true
        },
        "false_count": 3,
        "true_count": 5
      },
      "severity": "info",
      "status": "pass",
      "surface": "fonts"
    },
    {
      "detector_check": "iphey_runtime_probe_canvas",
      "evidence_ref": "sanitized_runtime_observation",
      "finding": "iphey page context rendered the sanitized 64x32 Canvas 2D probe and committed only SHA-256 digests and dimensions.",
      "normalized_values": {
        "available": true,
        "dataUrlSha256": "535cf055133e79e229dabd182c9bf6f72676a9138a820e2b3537dd15d84c3be6",
        "height": 32,
        "imageDataSha256": "110fd4019954d900bb4f3e4f092b3c26b467fa1187b4c7b3d6315443f1a5b9c5",
        "sampleCount": 8192,
        "width": 64
      },
      "severity": "info",
      "status": "pass",
      "surface": "canvas"
    },
    {
      "detector_check": "iphey_runtime_probe_webgl",
      "evidence_ref": "sanitized_runtime_observation",
      "finding": "iphey page context reported configured WebGL debug vendor/renderer strings.",
      "normalized_values": {
        "renderer": "Intel Iris OpenGL Engine",
        "vendor": "Intel Inc."
      },
      "severity": "info",
      "status": "pass",
      "surface": "webgl"
    },
    {
      "detector_check": "iphey_runtime_probe_storage",
      "evidence_ref": "sanitized_runtime_observation",
      "finding": "iphey page context reported navigator.storage.estimate quota from configured 8192 MiB persona.",
      "normalized_values": {
        "quota": 8589934592,
        "usage": 0,
        "usageDetails": {}
      },
      "severity": "info",
      "status": "pass",
      "surface": "storage_quota"
    },
    {
      "detector_check": "iphey_runtime_probe_automation",
      "evidence_ref": "sanitized_runtime_observation",
      "finding": "iphey page context reported navigator.webdriver=false.",
      "normalized_values": {
        "webdriver": false
      },
      "severity": "info",
      "status": "pass",
      "surface": "automation_signals"
    }
  ],
  "run_id": "detrun_linux_x64_iphey_uach_headless_docker_direct_20260709",
  "runtime_id": "browseforge-chromium",
  "runtime_version": "v0.1.0-alpha.0",
  "sanitization": {
    "cookies_storage_redacted": true,
    "credentials_redacted": true,
    "ip_redacted": true,
    "notes": "Raw iphey page text, browser storage, and network identifiers are not committed; committed evidence stores sanitized page title/url, structured UA-CH values, text hash/excerpt hash reference, and raw capture SHA only.",
    "profiles_redacted": true,
    "raw_capture_committed": false,
    "sanitizer_version": "source-detector-harness-iphey-uach-1",
    "screenshot_metadata_redacted": true,
    "tokens_redacted": true
  },
  "schema_version": "1.1",
  "status": "passed",
  "storage": {
    "evidence_path": "detectors/evidence/v0.1.0-alpha.0/linux-x64/iphey/detrun_linux_x64_iphey_uach_headless_docker_direct_20260709.json",
    "raw_capture_sha256": "06f9ebc356c3cd878cbb7b4e6f229be04234170bb0d431110999cb6debecaac7",
    "sha256": "fa4e497e5fdb9154efd9b66e093eac2fe868cecd989a223adf9920928a6a35f0",
    "summary_path": "detector-summary.json"
  },
  "target": {
    "arch": "amd64",
    "browser_family": "chromium",
    "browser_version": "150.0.7871.101",
    "container": true,
    "gpu_mode": "headless swiftshader",
    "host_os": "macOS Docker Desktop linux/amd64 emulation",
    "locale_profile": "zh-TW",
    "platform": "linux-x64",
    "proxy_region_redacted": "none",
    "timezone_profile": "Asia/Taipei"
  },
  "tested_at": "2026-07-09T09:06:21.068686+00:00"
}
