{
  "artifact_id": "browseforge-runtime-chromium-v0.1.0-alpha.0-linux-x64",
  "detector": {
    "category": "consistency",
    "detector_id": "pixelscan",
    "manifest_ref": "knowledge/manifests/detectors.json#pixelscan",
    "name": "Pixelscan",
    "url": "https://pixelscan.net/fingerprint-check"
  },
  "evidence_id": "evidence_linux_x64_pixelscan_uach_headless_docker_direct_20260709",
  "failure_mode": "none",
  "harness": {
    "mode": "live_collect",
    "name": "browseforge-detector-harness",
    "version": "0.1.0"
  },
  "kg": {
    "edges": [],
    "nodes": []
  },
  "matrix": {
    "container": true,
    "display_mode": "headless",
    "matrix_key": "linux-x64:pixelscan:uach:headless:direct:container",
    "network_mode": "direct",
    "proxy": "none",
    "required": false
  },
  "results": [
    {
      "detector_check": "pixelscan_fingerprint_check_js_api",
      "evidence_ref": "sanitized_runtime_observation",
      "finding": "Pixelscan fingerprint-check page loaded in the rebuilt packaged Linux runtime and navigator.userAgentData high entropy values matched the configured Linux Chromium persona, including fullVersionList Chromium 150.0.7871.101.",
      "normalized_values": {
        "available": true,
        "fullVersionList_present": true,
        "highEntropy": {
          "architecture": "x86",
          "bitness": "64",
          "brands": [
            {
              "brand": "Not;A=Brand",
              "version": "8"
            },
            {
              "brand": "Chromium",
              "version": "150"
            }
          ],
          "fullVersionList": [
            {
              "brand": "Not;A=Brand",
              "version": "8"
            },
            {
              "brand": "Chromium",
              "version": "150.0.7871.101"
            }
          ],
          "mobile": false,
          "model": "",
          "platform": "Linux",
          "platformVersion": "6.8.0",
          "wow64": false
        },
        "lowEntropy": {
          "brands": [
            {
              "brand": "Not;A=Brand",
              "version": "8"
            },
            {
              "brand": "Chromium",
              "version": "150"
            }
          ],
          "mobile": false,
          "platform": "Linux"
        },
        "title": "Check browser fingerprinting with Pixelscan \ud83d\udd0eAnalyze your digital trail",
        "url": "https://pixelscan.net/fingerprint-check"
      },
      "raw_value_hash": "ab1ccde0476174ce0d9521feb2a8b19b9ccba46e4e9facbd374227cf2a4dd109",
      "severity": "low",
      "status": "pass",
      "surface": "client_hints"
    },
    {
      "detector_check": "pixelscan_runtime_probe_audio",
      "evidence_ref": "sanitized_runtime_observation",
      "finding": "Pixelscan page context produced sanitized OfflineAudioContext summary with deterministic sampleRate/length/sum fields; raw samples are limited to sanitized numeric summary.",
      "normalized_values": {
        "available": true,
        "firstSamples": [
          -6.1e-07,
          4.4e-07,
          -4.4e-07,
          1.4e-07,
          1e-08,
          1.3e-07,
          -3.3e-07,
          8.7e-07
        ],
        "length": 44100,
        "sampleRate": 44100,
        "sum": 7.2e-07,
        "sumAbs": 0.00017846
      },
      "severity": "info",
      "status": "pass",
      "surface": "audio"
    },
    {
      "detector_check": "pixelscan_runtime_probe_fonts",
      "evidence_ref": "sanitized_runtime_observation",
      "finding": "Pixelscan page context reported document.fonts.check availability for sampled desktop font families; this is availability evidence, not glyph raster parity.",
      "normalized_values": {
        "available": true,
        "checks": {
          "Arial": true,
          "Calibri": true,
          "Consolas": true,
          "Courier New": true,
          "DejaVu Sans": true,
          "Noto Sans CJK TC": true,
          "Segoe UI": true,
          "Times New Roman": true
        },
        "false_count": 0,
        "true_count": 8
      },
      "severity": "info",
      "status": "pass",
      "surface": "fonts"
    },
    {
      "detector_check": "pixelscan_runtime_probe_canvas",
      "evidence_ref": "sanitized_runtime_observation",
      "finding": "Pixelscan page context rendered the sanitized 64x32 Canvas 2D probe and committed only SHA-256 digests and dimensions.",
      "normalized_values": {
        "available": true,
        "dataUrlSha256": "535cf055133e79e229dabd182c9bf6f72676a9138a820e2b3537dd15d84c3be6",
        "height": 32,
        "imageDataSha256": "110fd4019954d900bb4f3e4f092b3c26b467fa1187b4c7b3d6315443f1a5b9c5",
        "sampleCount": 8192,
        "width": 64
      },
      "severity": "info",
      "status": "pass",
      "surface": "canvas"
    },
    {
      "detector_check": "pixelscan_runtime_probe_webgl",
      "evidence_ref": "sanitized_runtime_observation",
      "finding": "Pixelscan page context reported configured WebGL debug vendor/renderer plus sanitized extension count, extension hash, parameter hash, shader precision hash, and rendered pixel hash.",
      "normalized_values": {
        "available": true,
        "extensionCount": 35,
        "extensionSha256": "fe647fce9cfb3d803ce51ca503e31be35575e4b23fec44a52cc445492483285e",
        "parameterSha256": "a2df76668f8cdba6664b72c12640a65af4b971df07a5b304f925afa00ae506ae",
        "pixelHeight": 16,
        "pixelSha256": "c7b8b8e0dcb78147f2dc0bac3c760235660711043cb49bb8f8537b419431a5c3",
        "pixelWidth": 16,
        "precisionSha256": "9d8d70c3ae44b595b82edfde9779a5c32c084fe87ab53c455cca173f4dca1d3b",
        "renderer": "Intel Iris OpenGL Engine",
        "vendor": "Intel Inc."
      },
      "severity": "info",
      "status": "pass",
      "surface": "webgl"
    },
    {
      "detector_check": "pixelscan_runtime_probe_storage",
      "evidence_ref": "sanitized_runtime_observation",
      "finding": "Pixelscan page context reported navigator.storage.estimate quota from configured 8192 MiB persona.",
      "normalized_values": {
        "quota": 8589934592,
        "usage": 0,
        "usageDetails": {}
      },
      "severity": "info",
      "status": "pass",
      "surface": "storage_quota"
    },
    {
      "detector_check": "pixelscan_runtime_probe_automation",
      "evidence_ref": "sanitized_runtime_observation",
      "finding": "Pixelscan page context reported navigator.webdriver=false.",
      "normalized_values": {
        "webdriver": false
      },
      "severity": "info",
      "status": "pass",
      "surface": "automation_signals"
    }
  ],
  "run_id": "detrun_linux_x64_pixelscan_uach_headless_docker_direct_20260709",
  "runtime_id": "browseforge-chromium",
  "runtime_version": "v0.1.0-alpha.0",
  "sanitization": {
    "cookies_storage_redacted": true,
    "credentials_redacted": true,
    "ip_redacted": true,
    "notes": "Raw Pixelscan page text, browser storage, and network identifiers are not committed; committed evidence stores sanitized page title/url, structured UA-CH values, text hash/excerpt hash reference, and raw capture SHA only; committed evidence stores sanitized WebGL metadata hashes/counts and does not commit raw extension, parameter, shader, or pixel payloads.",
    "profiles_redacted": true,
    "raw_capture_committed": false,
    "sanitizer_version": "source-detector-harness-pixelscan-uach-1",
    "screenshot_metadata_redacted": true,
    "tokens_redacted": true
  },
  "schema_version": "1.1",
  "status": "passed",
  "storage": {
    "evidence_path": "detectors/evidence/v0.1.0-alpha.0/linux-x64/pixelscan/detrun_linux_x64_pixelscan_uach_headless_docker_direct_20260709.json",
    "raw_capture_sha256": "0a6887508866e672af4cc385f332a7eef962de0363d76f0a57fe99d9396ffdf5",
    "sha256": "058fd2bbe9dda770e35f831e3a72a356b64155cc3557cd03b12d7336d306c41c",
    "summary_path": "detector-summary.json"
  },
  "target": {
    "arch": "amd64",
    "browser_family": "chromium",
    "browser_version": "150.0.7871.101",
    "container": true,
    "gpu_mode": "headless swiftshader",
    "host_os": "macOS Docker Desktop linux/amd64 emulation",
    "locale_profile": "zh-TW",
    "platform": "linux-x64",
    "proxy_region_redacted": "none",
    "timezone_profile": "Asia/Taipei"
  },
  "tested_at": "2026-07-09T17:01:23.731872+00:00"
}
