{
  "artifact_id": "browseforge-runtime-chromium-v0.1.0-alpha.0-linux-x64",
  "detector": {
    "category": "cross_surface_consistency",
    "detector_id": "creepjs",
    "manifest_ref": "knowledge/manifests/detectors.json#creepjs",
    "name": "CreepJS",
    "url": "https://abrahamjuliot.github.io/creepjs/"
  },
  "evidence_id": "evidence_linux_x64_creepjs_uach_headless_docker_direct_20260709",
  "failure_mode": "none",
  "harness": {
    "mode": "live_collect",
    "name": "browseforge-detector-harness",
    "version": "0.1.0"
  },
  "kg": {
    "edges": [],
    "nodes": []
  },
  "matrix": {
    "container": true,
    "display_mode": "headless",
    "matrix_key": "linux-x64:creepjs:uach:headless:direct:container",
    "network_mode": "direct",
    "proxy": "none",
    "required": false
  },
  "results": [
    {
      "detector_check": "creepjs_fingerprint_check_js_api",
      "evidence_ref": "sanitized_runtime_observation",
      "finding": "CreepJS page loaded in the rebuilt packaged Linux runtime and navigator.userAgentData high entropy values matched the configured Linux Chromium persona, including fullVersionList Chromium 150.0.7871.101.",
      "normalized_values": {
        "available": true,
        "fullVersionList_present": true,
        "highEntropy": {
          "architecture": "x86",
          "bitness": "64",
          "brands": [
            {
              "brand": "Not;A=Brand",
              "version": "8"
            },
            {
              "brand": "Chromium",
              "version": "150"
            }
          ],
          "fullVersionList": [
            {
              "brand": "Not;A=Brand",
              "version": "8"
            },
            {
              "brand": "Chromium",
              "version": "150.0.7871.101"
            }
          ],
          "mobile": false,
          "model": "",
          "platform": "Linux",
          "platformVersion": "6.8.0",
          "wow64": false
        },
        "lowEntropy": {
          "brands": [
            {
              "brand": "Not;A=Brand",
              "version": "8"
            },
            {
              "brand": "Chromium",
              "version": "150"
            }
          ],
          "mobile": false,
          "platform": "Linux"
        },
        "title": "CreepJS",
        "url": "https://abrahamjuliot.github.io/creepjs/"
      },
      "raw_value_hash": "07cb50bd2faf6da556ff68ae6864a56a58025ff9608146d808d65f8a1e9831b4",
      "severity": "low",
      "status": "pass",
      "surface": "client_hints"
    }
  ],
  "run_id": "detrun_linux_x64_creepjs_uach_headless_docker_direct_20260709",
  "runtime_id": "browseforge-chromium",
  "runtime_version": "v0.1.0-alpha.0",
  "sanitization": {
    "cookies_storage_redacted": true,
    "credentials_redacted": true,
    "ip_redacted": true,
    "notes": "Raw CreepJS page text, browser storage, and network identifiers are not committed; committed evidence stores sanitized page title/url, structured UA-CH values, text hash/excerpt hash reference, and raw capture SHA only.",
    "profiles_redacted": true,
    "raw_capture_committed": false,
    "sanitizer_version": "source-detector-harness-creepjs-uach-1",
    "screenshot_metadata_redacted": true,
    "tokens_redacted": true
  },
  "schema_version": "1.1",
  "status": "passed",
  "storage": {
    "evidence_path": "detectors/evidence/v0.1.0-alpha.0/linux-x64/creepjs/detrun_linux_x64_creepjs_uach_headless_docker_direct_20260709.json",
    "raw_capture_sha256": "ae3a2af0780035b913b618c118b88f04b396e3c30ae95858fc44415d63c34bb0",
    "sha256": "88c27c2421091ffc8eb4efac512dfe7fbfa7309e6cf499bba5cce62215ab124b",
    "summary_path": "detector-summary.json"
  },
  "target": {
    "arch": "amd64",
    "browser_family": "chromium",
    "browser_version": "150.0.7871.101",
    "container": true,
    "gpu_mode": "headless swiftshader",
    "host_os": "macOS Docker Desktop linux/amd64 emulation",
    "locale_profile": "zh-TW",
    "platform": "linux-x64",
    "proxy_region_redacted": "none",
    "timezone_profile": "Asia/Taipei"
  },
  "tested_at": "2026-07-09T09:17:48.668383+00:00"
}
